{
  "version": 1,
  "region": "kanto",
  "depart": "kanto.bourg-palette",
  "premierCombat": "kanto.route-1",
  "zones": [
    {
      "id": "kanto.bourg-palette",
      "nom": "Bourg Palette",
      "sansCombat": true,
      "message": "Pas de Pokémon sauvage ici. Va sur la Route 1 pour combattre.",
      "decor": "kanto/bourg-palette.webp",
      "liens": [
        {
          "vers": "kanto.route-1"
        }
      ],
      "ancienId": 0
    },
    {
      "id": "kanto.route-1",
      "nom": "Route 1",
      "decor": "kanto/route-1.webp",
      "niveaux": [
        2,
        5
      ],
      "etapes": 10,
      "multiplicateurPv": 1,
      "sauvages": [
        {
          "pokemon": 19,
          "rarete": "commun",
          "apparition": 0.3,
          "capture": 255
        },
        {
          "pokemon": 16,
          "rarete": "commun",
          "apparition": 0.3,
          "capture": 255
        },
        {
          "pokemon": 21,
          "rarete": "commun",
          "apparition": 0.2,
          "capture": 255
        },
        {
          "pokemon": 20,
          "rarete": "peu-commun",
          "apparition": 0.1,
          "capture": 127
        },
        {
          "pokemon": 17,
          "rarete": "peu-commun",
          "apparition": 0.05,
          "capture": 120
        },
        {
          "pokemon": 1,
          "rarete": "tres-rare",
          "apparition": 0.05,
          "capture": 45
        }
      ],
      "boss": {
        "pokemon": 19,
        "nom": "Rattata (Géant)",
        "niveau": 6,
        "capture": 0
      },
      "liens": [
        {
          "vers": "kanto.foret-de-jade",
          "si": {
            "type": "boss",
            "zone": "kanto.route-1"
          }
        }
      ],
      "ancienId": 1
    },
    {
      "id": "kanto.foret-de-jade",
      "nom": "Forêt de Jade",
      "decor": "kanto/foret-de-jade.webp",
      "niveaux": [
        5,
        8
      ],
      "etapes": 10,
      "multiplicateurPv": 1.5,
      "sauvages": [
        {
          "pokemon": 10,
          "rarete": "commun",
          "apparition": 0.25,
          "capture": 255
        },
        {
          "pokemon": 13,
          "rarete": "commun",
          "apparition": 0.25,
          "capture": 255
        },
        {
          "pokemon": 11,
          "rarete": "peu-commun",
          "apparition": 0.15,
          "capture": 120
        },
        {
          "pokemon": 14,
          "rarete": "peu-commun",
          "apparition": 0.15,
          "capture": 120
        },
        {
          "pokemon": 25,
          "rarete": "rare",
          "apparition": 0.15,
          "capture": 190
        },
        {
          "pokemon": 4,
          "rarete": "tres-rare",
          "apparition": 0.05,
          "capture": 45
        }
      ],
      "boss": {
        "pokemon": 12,
        "nom": "Papilusion",
        "niveau": 10,
        "capture": 0
      },
      "liens": [
        {
          "vers": "kanto.arene-d-argenta",
          "si": {
            "type": "boss",
            "zone": "kanto.foret-de-jade"
          }
        }
      ],
      "ancienId": 2
    },
    {
      "id": "kanto.arene-d-argenta",
      "nom": "Arène d'Argenta",
      "type": "arene",
      "decor": "kanto/arene-d-argenta.webp",
      "niveaux": [
        9,
        12
      ],
      "etapes": 10,
      "multiplicateurPv": 2.2,
      "sauvages": [
        {
          "pokemon": 74,
          "rarete": "commun",
          "apparition": 0.3,
          "capture": 255
        },
        {
          "pokemon": 27,
          "rarete": "commun",
          "apparition": 0.25,
          "capture": 255
        },
        {
          "pokemon": 29,
          "rarete": "peu-commun",
          "apparition": 0.15,
          "capture": 235
        },
        {
          "pokemon": 32,
          "rarete": "peu-commun",
          "apparition": 0.15,
          "capture": 235
        },
        {
          "pokemon": 95,
          "rarete": "rare",
          "apparition": 0.1,
          "capture": 45
        },
        {
          "pokemon": 7,
          "rarete": "tres-rare",
          "apparition": 0.05,
          "capture": 45
        }
      ],
      "boss": {
        "pokemon": 95,
        "nom": "Pierre (Onix)",
        "niveau": 14,
        "capture": 0
      },
      "liens": [
        {
          "vers": "kanto.mont-selenite",
          "si": {
            "type": "boss",
            "zone": "kanto.arene-d-argenta"
          }
        }
      ],
      "ancienId": 3
    },
    {
      "id": "kanto.mont-selenite",
      "nom": "Mont Sélénite",
      "decor": "kanto/mont-selenite.webp",
      "niveaux": [
        12,
        15
      ],
      "etapes": 10,
      "multiplicateurPv": 3.5,
      "sauvages": [
        {
          "pokemon": 41,
          "rarete": "commun",
          "apparition": 0.4,
          "capture": 255
        },
        {
          "pokemon": 46,
          "rarete": "commun",
          "apparition": 0.2,
          "capture": 190
        },
        {
          "pokemon": 129,
          "rarete": "commun",
          "apparition": 0.2,
          "capture": 255
        },
        {
          "pokemon": 35,
          "rarete": "rare",
          "apparition": 0.1,
          "capture": 150
        },
        {
          "pokemon": 39,
          "rarete": "rare",
          "apparition": 0.05,
          "capture": 170
        },
        {
          "pokemon": 113,
          "rarete": "tres-rare",
          "apparition": 0.05,
          "capture": 30
        }
      ],
      "boss": {
        "pokemon": 36,
        "nom": "Mélodelfe",
        "niveau": 16,
        "capture": 0
      },
      "liens": [
        {
          "vers": "kanto.arene-d-azuria",
          "si": {
            "type": "boss",
            "zone": "kanto.mont-selenite"
          }
        }
      ],
      "ancienId": 4
    },
    {
      "id": "kanto.arene-d-azuria",
      "nom": "Arène d'Azuria",
      "type": "arene",
      "decor": "kanto/arene-d-azuria.webp",
      "niveaux": [
        15,
        18
      ],
      "etapes": 10,
      "multiplicateurPv": 6,
      "sauvages": [
        {
          "pokemon": 43,
          "rarete": "commun",
          "apparition": 0.21,
          "capture": 255
        },
        {
          "pokemon": 69,
          "rarete": "commun",
          "apparition": 0.21,
          "capture": 255
        },
        {
          "pokemon": 60,
          "rarete": "peu-commun",
          "apparition": 0.18,
          "capture": 255
        },
        {
          "pokemon": 120,
          "rarete": "peu-commun",
          "apparition": 0.15,
          "capture": 225
        },
        {
          "pokemon": 118,
          "rarete": "peu-commun",
          "apparition": 0.1,
          "capture": 225
        },
        {
          "pokemon": 54,
          "rarete": "rare",
          "apparition": 0.1,
          "capture": 190
        },
        {
          "pokemon": 124,
          "rarete": "tres-rare",
          "apparition": 0.05,
          "capture": 45
        }
      ],
      "boss": {
        "pokemon": 121,
        "nom": "Ondine (Staross)",
        "niveau": 21,
        "capture": 0
      },
      "liens": [
        {
          "vers": "kanto.pont-pepite",
          "si": {
            "type": "boss",
            "zone": "kanto.arene-d-azuria"
          }
        }
      ],
      "ancienId": 5
    },
    {
      "id": "kanto.pont-pepite",
      "nom": "Pont Pépite",
      "decor": "kanto/pont-pepite.webp",
      "niveaux": [
        17,
        20
      ],
      "etapes": 10,
      "multiplicateurPv": 11,
      "sauvages": [
        {
          "pokemon": 63,
          "rarete": "commun",
          "apparition": 0.3,
          "capture": 200
        },
        {
          "pokemon": 17,
          "rarete": "commun",
          "apparition": 0.2,
          "capture": 120
        },
        {
          "pokemon": 48,
          "rarete": "peu-commun",
          "apparition": 0.2,
          "capture": 190
        },
        {
          "pokemon": 79,
          "rarete": "peu-commun",
          "apparition": 0.15,
          "capture": 190
        },
        {
          "pokemon": 22,
          "rarete": "rare",
          "apparition": 0.14,
          "capture": 90
        },
        {
          "pokemon": 151,
          "rarete": "legendaire",
          "apparition": 0.01,
          "capture": 45
        }
      ],
      "boss": {
        "pokemon": 18,
        "nom": "Rival (Roucarnage)",
        "niveau": 23,
        "capture": 0
      },
      "liens": [
        {
          "vers": "kanto.arene-de-carmin",
          "si": {
            "type": "boss",
            "zone": "kanto.pont-pepite"
          }
        }
      ],
      "ancienId": 6
    },
    {
      "id": "kanto.arene-de-carmin",
      "nom": "Arène de Carmin",
      "type": "arene",
      "decor": "kanto/arene-de-carmin.webp",
      "niveaux": [
        20,
        25
      ],
      "etapes": 10,
      "multiplicateurPv": 13.5,
      "sauvages": [
        {
          "pokemon": 100,
          "rarete": "commun",
          "apparition": 0.3,
          "capture": 190
        },
        {
          "pokemon": 81,
          "rarete": "commun",
          "apparition": 0.3,
          "capture": 190
        },
        {
          "pokemon": 52,
          "rarete": "peu-commun",
          "apparition": 0.2,
          "capture": 255
        },
        {
          "pokemon": 83,
          "rarete": "rare",
          "apparition": 0.1,
          "capture": 45
        },
        {
          "pokemon": 25,
          "rarete": "rare",
          "apparition": 0.1,
          "capture": 190
        }
      ],
      "boss": {
        "pokemon": 26,
        "nom": "Major Bob (Raichu)",
        "niveau": 26,
        "capture": 0
      },
      "liens": [
        {
          "vers": "kanto.cave-taupiqueur",
          "si": {